{
  "$schema": "https://json-schema.org/draft/2020-12/schema",
  "$id": "https://ed4all.dev/ns/knowledge/v1/instruction_pair.schema.json",
  "title": "Instruction Pair (SFT)",
  "description": "Single instruction-following training example emitted by Trainforge's synthesize_training stage. One JSONL line per pair. Shapes are intentionally flat so downstream SFT trainers (Alpaca/OpenAI) can remap with a single projection.",
  "type": "object",
  "required": [
    "prompt",
    "completion",
    "chunk_id",
    "lo_refs",
    "bloom_level",
    "content_type",
    "seed",
    "decision_capture_id"
  ],
  "additionalProperties": true,
  "properties": {
    "prompt": {
      "type": "string",
      "minLength": 40,
      "maxLength": 400,
      "description": "The instruction a model must answer. Must not contain a verbatim span of 50+ consecutive characters from the source chunk text."
    },
    "completion": {
      "type": "string",
      "minLength": 50,
      "maxLength": 1200,
      "description": "The target completion the model should produce. The 1200-char ceiling replaces an earlier 600: an objective-complete worked answer carries the condition, each required step, and the resulting conclusion, which does not fit in 600 characters. Generation was never token-starved at 600 (Stage D budgets 1536 tokens and observed answers used ~100), so the old cap did not trim long answers — it rejected them, which is why accepted answers were grounded but too shallow to execute their own prompt."
    },
    "chunk_id": {
      "type": "string",
      "minLength": 1,
      "description": "Source chunk id from imscc_chunks/chunks.jsonl (Phase 7c rename of corpus/chunks.jsonl, e.g. sample_course_chunk_00042)."
    },
    "lo_refs": {
      "type": "array",
      "minItems": 1,
      "items": {"type": "string", "minLength": 1},
      "description": "Learning-outcome refs the source chunk maps to. Never empty: chunks without LO refs do not generate pairs."
    },
    "bloom_level": {
      "type": "string",
      "enum": ["remember", "understand", "apply", "analyze", "evaluate", "create"]
    },
    "content_type": {
      "type": "string",
      "description": "Content-type label from the source chunk. Free-string (derived from content_type_label or chunk_type when the label is missing).",
      "minLength": 1
    },
    "seed": {
      "type": "integer",
      "description": "Seed used for deterministic template selection and sampling. Same chunk + same seed -> identical pair."
    },
    "decision_capture_id": {
      "type": "string",
      "description": "event_id from the decision-capture log that records why this pair was synthesized. Resolves against the run's decisions JSONL.",
      "minLength": 1
    },
    "template_id": {
      "type": "string",
      "description": "Id of the prompt template used (bloom-level x content-type). Optional but useful for debugging."
    },
    "provider": {
      "type": "string",
      "enum": ["mock", "anthropic", "claude_session", "together", "local"],
      "description": "Which synthesis provider produced the pair."
    },
    "question_type": {
      "type": "string",
      "enum": [
        "multiple_choice",
        "multiple_response",
        "true_false",
        "short_answer",
        "essay",
        "matching",
        "fill_in_blank",
        "ordering",
        "hotspot"
      ],
      "$comment": "9-value canonical enum mirrored from schemas/taxonomies/question_type.json#/$defs/QuestionType. Inlined (not $ref'd) until P2.5 migrates this schema to Draft 2020-12; cross-draft $ref resolution is implementation-specific. Drift between this enum and the canonical taxonomy is a documentation bug — see plans/wave-D1-p0-fixes-2026-05-07.md § T1.2.",
      "description": "Canonical question-type discriminator consumed by the W6.B per-question-type summary and W7.A-C per-metric segmentation. Optional so legacy corpora pre-Wave-8 stay schema-valid."
    },
    "schema_version": {
      "type": "string",
      "const": "v1"
    },
    "promotion_status": {
      "type": "string",
      "enum": ["pending", "candidate", "validated", "trainable", "rejected"],
      "description": "GPT Feedback v2 P0c Fix 7a — training-pair promotion ladder. Optional on first land; emitter assigns 'pending' on first emit, then upgrades through candidate / validated / trainable / rejected per the TrainingPairPromotionValidator (Wave 2)."
    },
    "rejection_reason": {
      "type": ["string", "null"],
      "description": "Free-string rejection rationale. Populated only when promotion_status == 'rejected'."
    },
    "observed_bloom": {
      "type": ["string", "null"],
      "enum": ["remember", "understand", "apply", "analyze", "evaluate", "create", null],
      "description": "BERT-ensemble classification of the emitted prompt+completion. Null when classifier didn't run."
    },
    "bloom_alignment": {
      "type": ["boolean", "null"],
      "description": "True iff observed_bloom == bloom_level. Null when observed_bloom is unset."
    },
    "answer_support_score": {
      "type": ["number", "null"],
      "minimum": 0,
      "maximum": 1,
      "description": "Cosine similarity (or per-pair entailment score) between completion and the cited source chunk text. Null when the score wasn't computed."
    },
    "rationale_richness_score": {
      "type": ["number", "null"],
      "minimum": 0,
      "maximum": 1,
      "description": "Heuristic semantic-richness score over the rationale string. Null when not computed."
    },
    "source_chunk_id": {
      "type": "string",
      "minLength": 1,
      "description": "Stable id of the source chunk this pair was synthesized from. Optional in general; required when promotion_status == 'trainable' (see if/then clause). Closes the source-free-generation hole at the schema layer."
    },
    "per_claim_support": {
      "type": ["array", "null"],
      "description": "GPT Feedback v2 Wave 4 W4.A — per-sentence NLI entailment audit of the completion against the cited chunk text. One entry per sentence the claim-support validator scored. Null when NLI deps are missing (graceful-degrade) or when the validator hasn't run on this pair yet (legacy / pre-Wave-4 corpora). Mirrors the W2.E promotion_status migration shape: optional day-1, may upgrade to required-conditional once the validator has rolled across every active corpus. Per-item shape canonicalised at pair_audit_fields.schema.json#/$defs/PerClaimSupport (W-D4).",
      "items": {
        "$ref": "https://ed4all.dev/ns/knowledge/v1/pair_audit_fields.schema.json#/$defs/PerClaimSupport"
      }
    },
    "claim_support_rate": {
      "type": ["number", "null"],
      "minimum": 0,
      "maximum": 1,
      "description": "GPT Feedback v2 Wave 4 W4.A — fraction of scored sentences whose outcome was 'entailed'. Null when NLI deps are missing or the validator hasn't run on this pair."
    },
    "claim_contradicted_rate": {
      "type": ["number", "null"],
      "minimum": 0,
      "maximum": 1,
      "description": "GPT Feedback v2 Wave 4 W4.A — fraction of scored sentences whose outcome was 'contradicted'. Null when NLI deps are missing or the validator hasn't run on this pair."
    },
    "pair_lo_resolution": {
      "$ref": "https://ed4all.dev/ns/knowledge/v1/pair_audit_fields.schema.json#/$defs/PairLoResolution"
    },
    "pair_objective_alignment": {
      "type": ["array", "null"],
      "description": "GPT Feedback v2 Wave 4 W4.C — per-(pair, objective_id) delivery-alignment audit emitted by PairObjectiveDeliveryValidator. One entry per learning-outcome ref the pair claims to teach / assess. Mirrors the W1.7.C Block.objectiveAlignment surface but at pair scope (NLI entailment of the objective statement against prompt+completion + Bloom-level gap + action-verb presence). Null when the validator hasn't run on this pair (legacy / pre-Wave-4 corpora) or NLI deps are missing (graceful-degrade). Mirrors the W4.A / W4.B day-1 contract: optional now, may upgrade to required-conditional once the validator has rolled across every active corpus. Per-item shape canonicalised at pair_audit_fields.schema.json#/$defs/PairObjectiveAlignment (W-D4).",
      "items": {
        "$ref": "https://ed4all.dev/ns/knowledge/v1/pair_audit_fields.schema.json#/$defs/PairObjectiveAlignment"
      }
    },
    "pair_objective_alignment_pass_rate": {
      "type": ["number", "null"],
      "minimum": 0,
      "maximum": 1,
      "description": "GPT Feedback v2 Wave 4 W4.C — fraction of pair_objective_alignment[] entries whose status == 'delivered'. Null when pair_objective_alignment is null or empty."
    }
  },
  "if": {
    "properties": {
      "promotion_status": {"const": "trainable"}
    },
    "required": ["promotion_status"]
  },
  "then": {
    "required": ["source_chunk_id"]
  }
}
